Title,Date,Location,Description,Link
Ukulele Classes For Wee Fingers,Selected dates between 24th March 2025 - 1st March 2026,"Amplify Academy of Music, Glasgow South Side",Looking for the perfect way to introduce your child to music? Amplify's fun and engaging ukulele classes are designed just for 5 to 8-year-olds—the perfect stepping stone into music education!,https://www.whatsonglasgow.co.uk/event/152758-ukulele-classes-for-wee-fingers/
Urban: International Photography Exhibition,5th November 2025 - 29th November 2025,"The Glasgow Gallery of Photography: High Street, Glasgow City Centre","The Glasgow Gallery of Photography are hosting a month long photography exhibition, showcasing work on the theme Urban at their exhibition space on High Street during November.",https://www.whatsonglasgow.co.uk/event/131563-urban:-international-photography-exhibition/
Volbeat,10th November 2025,"The OVO Hydro, Glasgow City Centre",Volbeat have announced they will bring their 'Greatest Of All Tours' to Glasgow's OVO Hydro on Monday 10th November with special guests Bush and Gel!,https://www.whatsonglasgow.co.uk/event/107123-volbeat/
X-CRAFT ‘Dive Deep’,25th September 2025 - 1st September 2026,"The Submarine Centre, Helensburgh",X-CRAFT Dive Deep is an ALL NEW 360 Immersive Show that utilises MASSIVE 360 degree screens to tell the story of the submarine pioneers that paved the way for the submarines of today!,https://www.whatsonglasgow.co.uk/event/162355-x-craft-‘dive-deep’/
Dogs Trust Dog Training Classes,Selected dates between 2nd December 2024 - 29th December 2025,N/A,"The Dogs Trust offer training classes for dogs at all stages of their lives, in a relaxed and enjoyable environment at Newton Mearns Parish Church!",https://www.whatsoneastrenfrewshire.co.uk/event/096588-dogs-trust-dog-training-classes/
Monday Runday - Run Club for Mums,Selected dates between 24th March 2025 - 15th December 2025,N/A,Monday Runday is a free community run club for mums of all ages and stages... improve both your physical and mental health every Monday morning!,https://www.whatsoneastrenfrewshire.co.uk/event/152757-monday-runday---run-club-for-mums/
East Renfrewshire Bookbug Sessions,13th January 2025 - 20th December 2025,N/A,"Free, fun and fantastic! East Renfrewshire Libraries run several interactive song, rhyme and story Bookbug sessions!",https://www.whatsoneastrenfrewshire.co.uk/event/014755-east-renfrewshire-bookbug-sessions/
Discover the Joy of Reading in Japanese – Join Our Book Club!,1st March 2025 - 20th December 2025,N/A,"Are you passionate about Japanese but find it difficult to enjoy the learning process? Then join our Japanese Book Club, led by Edinburgh-based native tutor Hitomi Kobayashi-Prior!",https://www.whatsoninedinburgh.co.uk/event/152073-discover-the-joy-of-reading-in-japanese-–-join-our-book-club!/
Sunday (1994),10th November 2025,N/A,Sunday (1994) go from strength to strength as they bring their indie-tinged pop to The Mash House Edinburgh on Monday 10th November!,https://www.whatsoninedinburgh.co.uk/event/157000-sunday-(1994)/
Loud Poets Open Mic,Selected dates between 29th September 2025 - 8th December 2025,N/A,"Loud Poets invite poets to share their work at their regular open mic, taking place monthly at the Scottish Storytelling Centre.",https://www.whatsoninedinburgh.co.uk/event/161264-loud-poets-open-mic/
Scotland’s Gardens Scheme Open Garden: Dawson’s Garden,6th January 2025 - 21st December 2025,N/A,"Dawson’s Garden is a small cottage garden, full of surprises and designed to please the senses all year round with colour, form and scent.",https://www.whatsonfife.co.uk/event/151094-scotland’s-gardens-scheme-open-garden:-dawson’s-garden/
Small Business Market,28th March 2025 - 24th December 2025,N/A,Small Business Market is a monthly market based within Dunfermline's Kingsgate Shopping Centre featuring over 25 small businesses each month selling handmade crafts and more!,https://www.whatsonfife.co.uk/event/095470-small-business-market/
Big Fish,10th November 2025 - 12th November 2025,N/A,"MusT return in November with Big Fish, the story of Edward Bloom, a travelling salesman whose incredible, larger-than-life stories thrill everyone around him.",https://www.whatsonfife.co.uk/event/161575-big-fish/
Get Walking Lanarkshire Health Walks,1st January 2025 - 31st December 2025,N/A,"Join Get Walking Lanarkshire on one of their regular health walks! Enjoy the fresh air, meet new people and have a good blether!",https://www.whatsonlanarkshire.co.uk/event/041701-get-walking-lanarkshire-health-walks/
Bookbug at North Lanarkshire Heritage Centre,Selected dates between 6th January 2025 - 20th December 2025,N/A,"Free, fun and fantastic! North Lanarkshire Heritage Centre hold Bookbug sessions on Mondays during term time and every Saturday!",https://www.whatsonlanarkshire.co.uk/event/032744-bookbug-at-north-lanarkshire-heritage-centre/
Two & Tending - CANCELLED,8th November 2025 - 11th November 2025,N/A,Enjoy two plays for the price of one when East Kilbride Rep Theatre Club return to East Kilbride Arts Centre in October with Two and Tending.,https://www.whatsonlanarkshire.co.uk/event/158751-two-&-tending---cancelled/
Renfrewshire Bookbug Sessions,Selected dates between 6th January 2025 - 20th December 2025,N/A,"Free, fun and fantastic! Renfrewshire Libraries run several interactive song, rhyme and story Bookbug sessions throughout the week!",https://www.whatsonrenfrewshire.co.uk/event/017489-renfrewshire-bookbug-sessions/
Women’s Recreational Football,Selected dates between 18th June 2025 - 29th April 2026,N/A,"This recreational football session is for females aged 18 and above and of all abilities. It offers you the chance to play, enjoy the game, improve skills and connect with others.",https://www.whatsonrenfrewshire.co.uk/event/157271-women’s-recreational-football/
Buds Bootcamp,Selected dates between 26th May 2025 - 29th April 2026,N/A,"St Mirren FC Charitable Foundation's Buds Bootcamp is back. With fitness testing, upgraded sessions, energising workouts, and a whole lot of motivation, there's never been a better time to start!",https://www.whatsonrenfrewshire.co.uk/event/156051-buds-bootcamp/
The Man Who Could Paint Anything – The Legacy of Thomas Stuart Smith,1st March 2023 - 1st January 2028,N/A,This exhibition showcases some of The Stirling Smith Art Gallery and Museum’s remarkable art collection.,https://www.whatsonstirling.co.uk/event/093274-the-man-who-could-paint-anything-–-the-legacy-of-thomas-stuart-smith/
Scotland’s Gardens Scheme Open Garden: The Japanese Garden at Cowden,1st January 2025 - 31st December 2025,N/A,NA,https://www.whatsonstirling.co.uk/event/151089-scotland’s-gardens-scheme-open-garden:-the-japanese-garden-at-cowden/
Aerial Yoga,14th April 2025 - 31st March 2026,N/A,"Feeling inspired to try something new or expand your existing practice? Then join Andriani's Ahimsa Yoga at 3 Wellgreen Lane, Stirling for these Aerial Yoga classes on Mondays & Tuesdays!",https://www.whatsonstirling.co.uk/event/154049-aerial-yoga/
